Mod number,Mod name,Overview,Pre-Requisites,Co-requisites,Learning Objectives,Measureable Outcomes,Topics Covered,Textbook(s) and/or other required material,Delivery Format,Grading Scheme,Terms,Credits,Professors,Tags
50.053,Software Testing and Verification,"The course will introduce the fundamental concepts behind various automated testing algorithms and introduce basic concepts behind verification (specifically, model checking). The focus of the course will be more on the design of test algorithms than the usage of testing tools. At the end of the course, students are expected to gain knowledge on how to test arbitrarily complex systems. The course will provide a brief recap on the testing introduced earlier e.g., coverage-based testing and unit testing. Subsequently, it will dive deep into the systematic test generation strategies. The concluding week of the course will involve discussion of some selected and impactful recent research on software testing and draw an unusual synergy between the model checking (verification) and testing. The course will involve the development of a medium scale software project prototype from scratch (w/o libraries, w/o plugins) and the software prototype will be tested via the systematic testing mechanisms learned in the course. The software prototypes will be exchanged among different groups to mimic the testing culture in industry.",50.003,,"Design and implement software test generation algorithm from scratch.
Apply key ideas to design directed testing methodologies.
Learning and applying techniques to systematically test the software security.
Learning techniques to apply formal verification techniques on small to medium scale software.
Learning techniques to test software systems without oracles.
Learning techniques to test stateful software systems and ML-based software systems.","Build test generation techniques for complex software systems
Prototype software testing algorithms to validate medium scale software systems
Engineer test generation algorithms to direct towards faults and certain code
Build models and properties of software systems for verification
Build test generation algorithms for software systems without ground truth
Build blackbox software testing techniques for validating protocols and data-driven systems
Engineer software testing techniques to check regression errors","Dependency analysis, Slicing and data flow analysis.
Introduces specification based testing techniques, e.g., grammar-based testing.
Directed testing methodologies e.g., using the dependency analysis.
Basic mutation testing and higher order mutation testing.
Simulated annealing, genetic algorithm, others.
Change directed search, change directed symbolic execution.
Rationale behind the success of fuzzing in software security: Mutational and Generational Fuzzing. Hybrid Fuzzing.
Model checking algorithm (Explicit State Model checking and SAT-based Software Model Checking).
Metamorphic testing, differential testing etc.
Testing Machine Learning Systems, Testing stateful systems.","Required Texts and Readings
There are no textbooks for this course. The following book can be used as a reference for the course:
“Software Testing and Analysis: Process, Principles, and Techniques”, Mauro Pezze and Michal Young,
Chapters 1, 2, 4, 5, 6, 7, 9, 11, 12, 13, 14, 16.",,,"6,8",12,,Elective
50.054,Compiler Design and Program Analysis,"This course aims to introduce a new programming paradigm to the learners, Functional programming and the suite of advanced language features and design patterns for software design and development. By building on top of these techniques, the course curates the process of designing a modern compiler, through syntax analysis, intermediate representation construction, semantic analysis and code generation. More specifically the course focuses on the application of program analysis in areas of software verification, program optimization and software security analysis.",50.004,,"Implement software solutions using functional programming language and applying design patterns
Define the essential components in a program compilation pipeline
Design a compiler for an imperative programming language
Optimise the generated machine codes by applying program analysis techniques
Detect bugs and security flaws in software by applying program analysis techniques","Develop a parser for an imperative programming language with assignment, if-else and loop (AKA the source language) using Functional Programming
Implement a type checker for the source language
Develop a static analyser to eliminate dead codes
Implement the register allocation algorithm in the target code generation module
Develop a static analyser to identify potential security flaws in the source language","Functional Programming Basics: expression, conditional, function and recursion
Functional Programming: list, algebraic data types and pattern matching
Functional Programming Advanced: generics, GADT, type classes
Functional Programming Design patterns: Functor
Functional Programming Design patterns: Applicative and Monad
Syntax Analysis: lexing, top-down parsing
Syntax Analysis: bottom-up parsing, parser combinator
Intermediate Representation: pseudo assembly
Intermediate Representation: static single assignment
Semantic Analysis: dynamic semantics
Semantic Analysis: static semantics, type checking, type inference
Semantic Analysis: lattice, sign analysis
Semantic Analysis: liveness analysis, information flow analysis
Code Generation: instruction selection, register allocation
Memory management
Activation Record","Compilers: Principles, Techniques, and Tools is a computer science textbook by Alfred V. Aho, Monica S. Lam, Ravi Sethi, and Jeffrey D. Ullman
Modern Compiler Implementation in ML by Andrew W. Appel
Static Program Analysis by Anders Møller and Michael I. Schwartzbach",,,7,12,Kenny Lu Zhuo Ming,Elective
50.055,Special Topic: Machine Learning Operations,"In this course, students will learn the concepts and practice of machine learning operations (“MLOps”). The course does not teach the fundamentals of machine learning. Instead it focuses on building machine learning products. Students will learn how to identify viable use cases for machine learning, how to develop, test, deploy and monitor machine applications, how to manage machine learning projects and how to identify legal, ethical and data protection risks. Students will get hands-on experience on the complete machine learning development process, from experiments to deployment through course assignments and projects. The focus will be on deep learning and generative AI.","50.007 Machine Learning
50.039 Theory and Practice of Deep Learning or 60.001 Applied Deep Learning (can also be treated as co-requisite)",,"Identify good machine learning use cases
Conduct and manage machine learning experiments
Prompt and finetune foundation model
Deploy models to production
Monitor and continuously improve models
Manage machine learning projects
Identify legal and ethical issues","Students can identify viable use cases
Students can conduct and manage machine learning experiments
Students know how to prompt and finetune foundation models
Students understand machine learning architect and application stack
Students can create pipelines and deploy models
Students are able to conduct ethics, legal and data protection assessments","Introduction
Data
Machine learning experiment management
Foundation models
Foundation model and engineering and fine-tuning
Machine learning testing
Deployment
Monitoring and continuous improvement
Project and change management
Machine learning business case and commercials
Legal and data protection
AI ethics and regulation
AI user ex",,,,8,12,Daniel Dahlmeier,Elective
50.056,Software Abstraction Functional Proramming,"This course introduces students to functional programming and how to construct software abstractions. Students learn how to compose functions and perform computation in a functional way. Higher order function will be taught as a way to abstract computation. The course then introduces students on how they can abstract data in functional programming. The students will be brought into a discussion of state-based computation and how it is best done to allow better testing and concurrency. In the later part of the course, students will learn how they can apply many these concepts to create meta circular evaluator and implement lazy evaluations. The course introduces many concepts that inspires various programming languages and, throughout, the idea of software abstraction is emphasised.",10.025,,"Learn functional programming concepts and principles
Create abstractions for computation and data
Discuss the effect of mutability in computation
Implement state-based and stream-processing approach in a functional way
Create metalinguistic abstraction","By the end of this course, students should be able to:

Use higher order functions to create abstraction for computations
Create abstraction to represent complex data
Discuss the advantages and disadvantages of assignment operator in imperative programming
Implement state-based model
Implement stream-processing approach for computing sequences and iterations
Create meta-circular evaluator
Discuss the advantages of lazy evaluations and implement it","Introducing Functional Programming
Abstraction Using Functions
Data Abstraction
Generic Operations for Data Abstraction
Modelling State using Object
Stream-based Approach for State Computation
Metalinguistic Abstraction
Lazy Evaluation",,,,"6, 8",12,"Oka Kurniawan,
Kenny Lu Zhuo Ming",Elective
